id,title,category,word_count,content_clean
cnt_0000,TypeScript Best Practices for type narrowing,Frontend,14,key concepts behind type narrowing typescript relevant catching prop and state mismatches before runtime
cnt_0001,Getting Started with Computer vision,Data Science,13,exploring convolutional neural networks with computer vision way extracting spatial features from images
cnt_0002,JWT Deep Dive: Stateless authentication,Backend,12,overview stateless authentication jwt focused issuing signed tokens instead server side sessions
cnt_0003,Why The HTML5 Drag and Drop API Matters in Drag and drop,Frontend,20,exploring the html5 drag and drop api with drag and drop way building sortable lists and kanban boards the browser
cnt_0004,Getting Started with Idempotency keys,Backend,16,hands look safe retries idempotency keys essential for avoiding duplicate side effects when clients resend requests
cnt_0005,A Practical Guide to Streaming database changes,Databases,14,overview streaming database changes change data capture focused propagating updates other systems real time
cnt_0006,Understanding EC2 auto scaling in AWS,Cloud,14,key concepts behind ec2 auto scaling aws relevant adjusting compute capacity automatically based demand
cnt_0007,scikit-learn Best Practices for cross-validation,Data Science,12,overview cross validation scikit learn focused getting more reliable estimate model performance
cnt_0008,Batch processing Best Practices for scheduled data jobs,Data Engineering,12,overview scheduled data jobs batch processing focused running large transformations fixed schedule
cnt_0009,A Practical Guide to EC2 auto scaling,Cloud,14,how aws handles ec2 auto scaling useful for adjusting compute capacity automatically based demand
cnt_0010,Understanding The Web Animations API in Animations,Frontend,15,how animations handles the web animations api useful for creating smooth transitions without heavy libraries
cnt_0011,Vue Pinia State Management,Frontend,12,managing global reactive state vue applications using pinia the modern successor vuex
cnt_0012,Realm Database in Mobile apps,Mobile,12,implementing realm fast reactive offline first local database swift kotlin and reactnative
cnt_0013,Understanding Fault injection testing in Chaos engineering,DevOps,14,exploring fault injection testing with chaos engineering way verifying systems recover gracefully from failures
cnt_0014,Why Jetpack Compose Matters in Kotlin,Mobile,14,hands look jetpack compose kotlin essential for writing android uis declaratively without xml layouts
cnt_0015,Getting Started with Chaos engineering,DevOps,15,practical notes fault injection testing using chaos engineering aimed verifying systems recover gracefully from failures
cnt_0016,A Practical Guide to Fault injection testing,DevOps,15,hands look fault injection testing chaos engineering essential for verifying systems recover gracefully from failures
cnt_0017,Redis Best Practices for data structures,Databases,16,exploring data structures with redis way using sorted sets and hashes beyond simple key value caching
cnt_0018,A Practical Guide to Background task scheduling,Mobile,16,key concepts behind background task scheduling battery optimization relevant minimizing power drain from background app activity
cnt_0019,Data cleaning Deep Dive: Handling missing values,Data Science,15,exploring handling missing values with data cleaning way deciding whether impute drop flag missing data
cnt_0020,Understanding One-way streaming in Server-Sent Events,Backend,16,how server sent events handles one way streaming useful for sending continuous updates from server browser
cnt_0021,Data lakes Deep Dive: Schema-on-read,Data Engineering,15,practical notes schema read using datalakes aimed storing raw data flexibly before deciding its structure
cnt_0022,Zustand Deep Dive: Lightweight state management,Frontend,12,overview lightweight state management zustand focused avoiding boilerplate compared traditional redux stores
cnt_0023,scikit-learn Deep Dive: Cross-validation,Data Science,12,overview cross validation scikit learn focused getting more reliable estimate model performance
cnt_0024,Why Module federation Matters in Micro frontends,Frontend,15,overview module federation micro frontends focused letting independent teams ship parts the same web app
cnt_0025,Database Indexing best practices,Databases,14,why index column order matters composite indexes and how unused indexes hurt write performance
cnt_0026,Understanding PostgreSQL tsvector in Full-text search,Databases,16,how full text search handles postgresql tsvector useful for searching large text fields efficiently inside database
cnt_0027,SQL Correlated Subqueries,Databases,12,writing advanced sql queries using correlated subqueries and understanding their performance impact
cnt_0028,SEO Meta Tags Optimization,Frontend,13,configuring open graph twitter cards canonical urls and dynamic metadata single page applications
cnt_0029,A Practical Guide to Alerting rules,DevOps,14,key concepts behind alerting rules grafana relevant notifying teams automatically when metrics cross thresholds
cnt_0030,Why Supporting tablets and foldables Matters in Adaptive layouts,Mobile,16,exploring supporting tablets and foldables with adaptive layouts way designing that scales across different screen sizes
cnt_0031,Skeleton screens: Perceived performance,Frontend,15,hands look perceived performance skeleton screens essential for showing placeholder content while data still loading
cnt_0032,Trunk-based Development flow,DevOps,15,why high performing teams prefer trunk based development with short lived branches over heavy gitflow
cnt_0033,A Practical Guide to P-values,Data Science,13,hands look values statistical hypothesis testing essential for measuring evidence against null hypothesis
cnt_0034,Understanding Inline vector graphics in SVG icons,Frontend,15,how svg icons handles inline vector graphics useful for keeping icons crisp any screen resolution
cnt_0035,Why The Web Animations API Matters in Animations,Frontend,15,practical notes the web animations api using animations aimed creating smooth transitions without heavy libraries
cnt_0036,Understanding Firebase Cloud Messaging in Push notifications,Mobile,16,hands look firebase cloud messaging push notifications essential for engaging users even when the app closed
cnt_0037,Micro frontends Deep Dive: Module federation,Frontend,17,hands look module federation micro frontends essential for letting independent teams ship parts the same web app
cnt_0038,Medallion Architecture in Data Lakes,Data Engineering,13,designing data platforms with bronze raw silver cleaned and gold business storage zones
cnt_0039,A Practical Guide to Controlled vs uncontrolled inputs,Frontend,16,key concepts behind controlled uncontrolled inputs form handling relevant deciding how form state should managed react
cnt_0040,Database backups Best Practices for point-in-time recovery,Databases,16,key concepts behind point time recovery database backups relevant restoring data specific moment after data loss
cnt_0041,A Practical Guide to Vectorized operations,Data Science,12,exploring vectorized operations with numpy way speeding numerical computations without explicit loops
cnt_0042,Change data capture: Debezium,Data Engineering,15,key concepts behind debezium change data capture relevant capturing row level changes from source database
cnt_0043,Mobile security: Certificate pinning,Mobile,15,practical notes certificate pinning using mobile security aimed preventing man the middle attacks api calls
cnt_0044,ASP.NET Core Deep Dive: Minimal APIs,Backend,11,overview minimal apis aspdotnet core focused reducing boilerplate for small microservices
cnt_0045,Replication Deep Dive: Read replicas,Databases,15,how replication handles read replicas useful for scaling read heavy workloads across multiple database copies
cnt_0046,Understanding Stacking classifiers in Ensemble methods,Data Science,13,practical notes stacking classifiers using ensemble methods aimed combining multiple models improve accuracy
cnt_0047,PyTorch Best Practices for building neural networks,Data Science,16,practical notes building neural networks using pytorch aimed defining custom layers and training loops from scratch
cnt_0048,Model evaluation Best Practices for confusion matrices,Data Science,13,exploring confusion matrices with model evaluation way understanding the types errors classifier makes
cnt_0049,Apache Kafka Schema Registry,Data Engineering,12,managing avro json schemas real time kafka streaming pipelines using schema registry
cnt_0050,Data pipeline testing Best Practices for unit testing transformations,Data Engineering,17,practical notes unit testing transformations using data pipeline testing aimed catching bugs before they reach production data
cnt_0051,A Practical Guide to Handling schema drift,Data Engineering,14,overview handling schema drift data ingestion focused adapting pipelines when source data structure changes
cnt_0052,Understanding Handling large files in Multipart uploads,Backend,14,exploring handling large files with multipart uploads way processing file uploads efficiently the backend
cnt_0053,Ensemble methods: Stacking classifiers,Data Science,13,hands look stacking classifiers ensemble methods essential for combining multiple models improve accuracy
cnt_0054,Why Centralized observability Matters in Cloud monitoring,Cloud,14,exploring centralized observability with cloud monitoring way tracking metrics and logs across cloud resources
cnt_0055,Understanding Handling missing values in Data cleaning,Data Science,16,key concepts behind handling missing values data cleaning relevant deciding whether impute drop flag missing data
cnt_0056,OCI Block Volume performance scaling,Cloud,12,dynamically adjusting block volume iops performance tiers without downtime meet database demands
cnt_0057,AWS Lambda: Serverless functions,Cloud,13,exploring serverless functions with aws lambda way running code without provisioning managing servers
cnt_0058,Go Deep Dive: Goroutines,Backend,12,overview goroutines go focused running lightweight concurrent tasks with channels for synchronization
cnt_0059,Why Round robin vs least connections Matters in Load balancing algorithms,Backend,17,key concepts behind round robin least connections load balancing algorithms relevant distributing traffic evenly across backend replicas
cnt_0060,Getting Started with Cloud load balancers,Cloud,16,practical notes distributing traffic globally using cloud load balancers aimed routing users the nearest healthy region
cnt_0061,A Practical Guide to Reusable workflows,DevOps,12,hands look reusable workflows githubactions essential for sharing logic across multiple repositories
cnt_0062,History Data Backfilling in Airflow,Data Engineering,10,running historical backfills apache airflow without overloading databases active tasks
cnt_0063,Getting Started with Hyperparameter tuning,Data Science,16,how hyperparameter tuning handles grid search random search useful for finding the best model configuration systematically
cnt_0064,A Practical Guide to ARIA attributes,Frontend,15,key concepts behind aria attributes accessibility a11y relevant making interactive widgets usable with screen readers
cnt_0065,Why Fine-tuning pretrained models Matters in Transfer learning,Data Science,18,hands look fine tuning pretrained models transfer learning essential for adapting large models new task with less data
cnt_0066,Understanding Multi-stage builds in Docker,DevOps,14,exploring multi stage builds with docker way keeping container images small and production ready
cnt_0067,Getting Started with Tailwind CSS,Frontend,16,how tailwind css handles utility first classes useful for styling components without writing custom css files
cnt_0068,Getting Started with Web Vitals,Frontend,14,exploring largest contentful paint with web vitals way measuring real user perceived loading performance
cnt_0069,Cloud compliance Best Practices for data residency requirements,Cloud,14,exploring data residency requirements with cloud compliance way keeping data within required geographic boundaries
cnt_0070,Data partitioning Best Practices for partitioning by date,Data Engineering,13,exploring partitioning date with data partitioning way improving query performance large datalake tables
cnt_0071,Data ingestion Best Practices for handling schema drift,Data Engineering,14,overview handling schema drift data ingestion focused adapting pipelines when source data structure changes
cnt_0072,Why The token bucket algorithm Matters in Rate limiting,Backend,16,exploring the token bucket algorithm with rate limiting way protecting api from abuse and traffic spikes
cnt_0073,Getting Started with Secrets management,DevOps,14,how secrets management handles hashicorp vault useful for storing credentials securely instead plain text
cnt_0074,Data governance Deep Dive: Access control policies,Data Engineering,16,practical notes access control policies using data governance aimed controlling who can view modify sensitive datasets
cnt_0075,Understanding Star schema design in Data warehousing,Databases,12,overview star schema design data warehousing focused optimizing tables for analytical queries
cnt_0076,Getting Started with Flutter,Mobile,16,hands look the widget tree flutter essential for building cross platform uis from single dart codebase
cnt_0077,PostgreSQL Deep Dive: Indexing strategies,Databases,12,practical notes indexing strategies using postgresql aimed speeding query performance large tables
cnt_0078,NestJS Dependency Injection,Backend,13,how dependency injection and providers work nestjs creating injectable services and resolving dependencies
cnt_0079,Getting Started with Auto-scaling groups,DevOps,14,practical notes scaling policies using auto scaling groups aimed adding removing instances based demand
cnt_0080,Getting Started with Database monitoring,Databases,14,how database monitoring handles slow query logs useful for identifying queries that need optimization
cnt_0081,Understanding L1 and L2 penalties in Regularization,Data Science,12,exploring and penalties with regularization way preventing model from overfitting training data
cnt_0082,Model evaluation Deep Dive: Confusion matrices,Data Science,14,practical notes confusion matrices using model evaluation aimed understanding the types errors classifier makes
cnt_0083,OAuth2: Authorization flows,Backend,16,how oauth2 handles authorization flows useful for delegating access without sharing user passwords with third parties
cnt_0084,Getting Started with Helm charts,DevOps,12,exploring templating kubernetes manifests with helm charts way reusing configuration across environments
cnt_0085,FastAPI Best Practices for Pydantic validation,Backend,14,key concepts behind pydantic validation fastapi relevant enforcing request schemas automatically with type hints
cnt_0086,Understanding Embedded databases in SQLite,Databases,14,practical notes embedded databases using sqlite aimed storing data locally without separate database server
cnt_0087,ELT pipelines: Transforming data in the warehouse,Data Engineering,13,overview transforming data the warehouse elt pipelines focused leveraging warehouse compute for transformations
cnt_0088,A Practical Guide to Multi-region failover,Cloud,16,how cloud disaster recovery handles multi region failover useful for keeping systems available during regional outage
cnt_0089,Database indexing: B-tree vs hash indexes,Databases,17,practical notes tree hash indexes using database indexing aimed choosing the right index type for query pattern
cnt_0090,Why RabbitMQ consumers Matters in Message queues,Backend,17,hands look rabbitmq consumers message queues essential for decoupling slow background work from the request response cycle
cnt_0091,Mobile performance Best Practices for reducing app startup time,Mobile,17,key concepts behind reducing app startup time mobile performance relevant improving the first impression users get app
cnt_0092,A Practical Guide to Single-page application navigation,Frontend,16,exploring single page application navigation with client side routing way changing views without full page reload
cnt_0093,A Practical Guide to Component libraries,Frontend,13,overview component libraries design systems focused keeping visual consistency across large product teams
cnt_0094,Canary releases: Gradual rollout,DevOps,15,how canary releases handles gradual rollout useful for exposing new version small subset users first
cnt_0095,Getting Started with Feature flags,DevOps,15,practical notes progressive delivery using feature flags aimed turning features and off without redeploying code
cnt_0096,Getting Started with Data pipeline testing,Data Engineering,17,key concepts behind unit testing transformations data pipeline testing relevant catching bugs before they reach production data
cnt_0097,Understanding HashiCorp Vault in Secrets management,DevOps,14,key concepts behind hashicorp vault secrets management relevant storing credentials securely instead plain text
cnt_0098,Next.js Deep Dive: Server-side rendering,Frontend,18,hands look server side rendering next js essential for improving first paint time and seo for react apps
cnt_0099,Azure Active Directory integration,Cloud,12,setting enterprise identity single sign sso and resource access control with azure
cnt_0100,A Practical Guide to Module federation,Frontend,16,exploring module federation with micro frontends way letting independent teams ship parts the same web app
cnt_0101,Chaos engineering: Fault injection testing,DevOps,15,key concepts behind fault injection testing chaos engineering relevant verifying systems recover gracefully from failures
cnt_0102,Getting Started with Cloud IAM,Cloud,16,how cloud iam handles least privilege access useful for granting only the permissions resource actually needs
cnt_0103,Getting Started with Cloud storage,Cloud,18,hands look cold hot storage tiers cloud storage essential for balancing cost against retrieval speed for stored data
cnt_0104,TensorFlow: Keras high-level API,Data Science,12,exploring keras high level api with tensorflow way prototyping deeplearning models quickly
cnt_0105,Database migrations Best Practices for versioned schema changes,Databases,14,exploring versioned schema changes with database migrations way evolving database schema safely over time
cnt_0106,Why ACID transactions on data lakes Matters in Delta Lake,Data Engineering,14,exploring acid transactions datalakes with delta lake way adding reliability large scale data storage
cnt_0107,A Practical Guide to Reducing app startup time,Mobile,17,hands look reducing app startup time mobile performance essential for improving the first impression users get app
cnt_0108,Data pipeline testing: Unit testing transformations,Data Engineering,17,practical notes unit testing transformations using data pipeline testing aimed catching bugs before they reach production data
cnt_0109,Load balancing algorithms Best Practices for round robin vs least connections,Backend,17,practical notes round robin least connections using load balancing algorithms aimed distributing traffic evenly across backend replicas
cnt_0110,Why Scaling based on custom metrics Matters in Auto-scaling,Cloud,14,exploring scaling based custom metrics with auto scaling way reacting application specific load signals
cnt_0111,Why Snowflake architecture Matters in Data warehouses,Data Engineering,12,overview snowflake architecture datawarehouses focused separating storage and compute for analytical workloads
cnt_0112,Getting Started with Data quality checks,Data Engineering,15,exploring validation rules with data quality checks way catching bad data before reaches downstream systems
cnt_0113,Why Event-driven integrations Matters in Webhooks,Backend,16,how webhooks handles event driven integrations useful for notifying external systems when something happens real time
cnt_0114,Jenkins Deep Dive: Declarative pipelines,DevOps,13,how jenkins handles declarative pipelines useful for defining build and deploy steps code
cnt_0115,AWS Lambda Best Practices for serverless functions,Cloud,14,practical notes serverless functions using aws lambda aimed running code without provisioning managing servers
cnt_0116,Why Network access rules Matters in Cloud security groups,Cloud,16,practical notes network access rules using cloud security groups aimed controlling inbound and outbound traffic resources
cnt_0117,Database locking Deep Dive: Deadlock prevention,Databases,15,hands look deadlock prevention database locking essential for avoiding transactions that block each other indefinitely
cnt_0118,Implementing CORS in FastAPI,Backend,13,how configure cross origin resource sharing fastapi using corsmiddleware allow safe browser requests
cnt_0119,Why Feature importance Matters in Random Forest,Data Science,12,overview feature importance random forest focused understanding which variables drive model predictions
cnt_0120,DevOps DORA Metrics tracking,DevOps,13,measuring team performance using deployment frequency lead time mttr and change failure rate
cnt_0121,Why Reusing database connections Matters in Connection pooling,Databases,15,key concepts behind reusing database connections connection pooling relevant reducing overhead for high traffic applications
cnt_0122,A Practical Guide to Query optimization,Databases,13,hands look query optimization mysql essential for rewriting slow queries using explain plans
cnt_0123,A Practical Guide to Idempotent tasks,Data Engineering,14,hands look idempotent tasks data pipelines essential for safely rerunning pipeline without duplicating data
cnt_0124,Cloud databases: Managed database services,Cloud,16,how cloud databases handles managed database services useful for offloading backups and patching the cloud provider
cnt_0125,Mobile accessibility: VoiceOver and TalkBack,Mobile,14,overview voiceover and talkback mobile accessibility focused making apps usable for visually impaired users
cnt_0126,Getting Started with Hybrid cloud,Cloud,16,hands look connecting premises and cloud hybrid cloud essential for extending existing infrastructure into the cloud
cnt_0127,GraphQL: Resolvers,Backend,13,hands look resolvers graphql essential for fetching only the fields client explicitly requests
cnt_0128,Kubernetes Best Practices for horizontal pod autoscaling,DevOps,12,exploring horizontal pod autoscaling with kubernetes way automatically adjusting replicas based load
cnt_0129,Message queues Best Practices for RabbitMQ consumers,Backend,17,key concepts behind rabbitmq consumers message queues relevant decoupling slow background work from the request response cycle
cnt_0130,Database partitioning Deep Dive: Range partitioning,Databases,12,overview range partitioning database partitioning focused splitting large tables date another key
cnt_0131,Confusion Matrix visualization,Data Science,11,creating clear confusion matrix heatmaps using seaborn evaluate multiclass prediction errors
cnt_0132,Why The bridge architecture Matters in React Native,Mobile,17,practical notes the bridge architecture using reactnative aimed letting javascript communicate with native ios and android modules
cnt_0133,A Practical Guide to PostgreSQL tsvector,Databases,15,exploring postgresql tsvector with full text search way searching large text fields efficiently inside database
cnt_0134,JWT: Stateless authentication,Backend,14,how jwt handles stateless authentication useful for issuing signed tokens instead server side sessions
cnt_0135,Cloud Container Registries,Cloud,12,storing managing and scanning docker container images oci registry aws ecr securely
cnt_0136,Understanding Metadata management in Data cataloging,Data Engineering,12,exploring metadata management with data cataloging way making datasets discoverable across organization
cnt_0137,Web Vitals Deep Dive: Largest Contentful Paint,Frontend,15,how web vitals handles largest contentful paint useful for measuring real user perceived loading performance
cnt_0138,Why Versioned schema changes Matters in Database migrations,Databases,15,how database migrations handles versioned schema changes useful for evolving database schema safely over time
cnt_0139,Android: The Activity lifecycle,Mobile,15,key concepts behind the activity lifecycle android relevant managing state correctly screens rotate go background
cnt_0140,Stream processing Best Practices for windowed aggregations,Data Engineering,13,exploring windowed aggregations with stream processing way computing metrics over continuously arriving data
cnt_0141,Swift Deep Dive: SwiftUI declarative views,Mobile,16,hands look swiftui declarative views swift essential for building ios interfaces with less imperative uikit code
cnt_0142,Infrastructure as Code: Immutable infrastructure,DevOps,13,exploring immutable infrastructure with infrastructure code way replacing servers instead patching them place
cnt_0143,Why Scheduled data jobs Matters in Batch processing,Data Engineering,13,exploring scheduled data jobs with batch processing way running large transformations fixed schedule
cnt_0144,OLTP vs OLAP modeling differences,Databases,11,designing highly normalized relational schemas 3nf denormalized star schemas for analytics
cnt_0145,Minimal APIs in ASP.NET Core,Backend,14,building lightweight microservices using minimal apis dotnet route handlers dependency injection and performance optimization
cnt_0146,Delta Lake ACID transactions,Data Engineering,11,bringing reliable transactions schema enforcement and time travel rollbacks objectstorage lakes
cnt_0147,Why Groupby aggregations Matters in Pandas,Data Science,12,how pandas handles groupby aggregations useful for summarizing large datasets category quickly
cnt_0148,Understanding Indexing strategies in PostgreSQL,Databases,12,hands look indexing strategies postgresql essential for speeding query performance large tables
