id,title,category,word_count,content_clean
cnt_0746,Why EC2 auto scaling Matters in AWS,Cloud,12,overview ec2 auto scaling aws focused adjusting compute capacity automatically based demand
cnt_0747,Getting Started with Local notifications,Mobile,12,overview scheduling reminders local notifications focused triggering alerts without server round trip
cnt_0748,Getting Started with Google Cloud Platform,Cloud,14,how gcp platform handles cloud run useful for deploying containerized apps without managing infrastructure
cnt_0749,A Practical Guide to Horizontal pod autoscaling,DevOps,13,practical notes horizontal pod autoscaling using kubernetes aimed automatically adjusting replicas based load
cnt_0750,A Practical Guide to Capturing and processing photos,Mobile,14,overview capturing and processing photos camera integration focused adding photo capture features mobile app
cnt_0751,A Practical Guide to The Activity lifecycle,Mobile,15,practical notes the activity lifecycle using android aimed managing state correctly screens rotate go background
cnt_0752,Data quality checks Deep Dive: Validation rules,Data Engineering,16,key concepts behind validation rules data quality checks relevant catching bad data before reaches downstream systems
cnt_0753,Getting Started with CSS Grid,Frontend,15,how css grid handles two dimensional layouts useful for arranging elements rows and columns declaratively
cnt_0754,Data ingestion Deep Dive: Handling schema drift,Data Engineering,14,overview handling schema drift data ingestion focused adapting pipelines when source data structure changes
cnt_0755,Redis Pub/Sub message broker,Databases,12,using redis publish subscribe capabilities build lightweight real time message notification systems
cnt_0756,Getting Started with Graph databases,Databases,15,how graph databases handles neo4j relationships useful for modeling highly connected data like social networks
cnt_0757,Why Code shrinking Matters in App size optimization,Mobile,16,exploring code shrinking with app size optimization way reducing apk and ipa size for faster downloads
cnt_0758,Hyperparameter tuning with Optuna,Data Science,11,optimizing machinelearning model hyperparameters efficiently using bayesian optimization with optuna python
cnt_0759,Why Active Record callbacks Matters in Ruby on Rails,Backend,16,practical notes active record callbacks using ruby rails aimed running custom logic before after saving record
cnt_0760,Why Wide-column storage Matters in Cassandra,Databases,15,key concepts behind wide column storage cassandra relevant handling massive write throughput across distributed nodes
cnt_0761,Amazon S3: Object storage lifecycle policies,Cloud,15,practical notes objectstorage lifecycle policies using amazon aimed automatically archiving old data cheaper storage tiers
cnt_0762,PostgreSQL EXPLAIN ANALYZE interpretation,Databases,13,reading query execution plans identify sequential table scans index scans and join costs
cnt_0763,A Practical Guide to Readiness and liveness probes,DevOps,16,how container orchestration handles readiness and liveness probes useful for letting kubernetes know when pod healthy
cnt_0764,Getting Started with Apache Flink,Data Engineering,15,hands look stateful stream processing apache flink essential for maintaining state across events real time
cnt_0765,Why Access control policies Matters in Data governance,Data Engineering,16,practical notes access control policies using data governance aimed controlling who can view modify sensitive datasets
cnt_0766,Getting Started with Gesture recognition,Mobile,15,exploring custom touch handlers with gesture recognition way building swipe and pinch interactions mobile app
cnt_0767,A Practical Guide to Idempotent playbooks,DevOps,13,how ansible handles idempotent playbooks useful for applying configuration changes safely multiple times
cnt_0768,Getting Started with Data partitioning,Data Engineering,13,exploring partitioning date with data partitioning way improving query performance large datalake tables
cnt_0769,Getting Started with Database partitioning,Databases,14,practical notes range partitioning using database partitioning aimed splitting large tables date another key
cnt_0770,Angular Best Practices for reactive forms,Frontend,10,overview reactive forms angular focused validating complex user input declaratively
cnt_0771,Storybook: Isolated component development,Frontend,16,how storybook handles isolated component development useful for building and documenting pieces outside the full app
cnt_0772,Biometric authentication Best Practices for Face ID and fingerprint APIs,Mobile,15,overview face and fingerprint apis biometric authentication focused letting users log securely without typing password
cnt_0773,Getting Started with Natural Language Processing,Data Science,15,hands look tokenization natural language processing essential for splitting text into units model can process
cnt_0774,Secrets management: HashiCorp Vault,DevOps,13,exploring hashicorp vault with secrets management way storing credentials securely instead plain text
cnt_0775,Understanding Coroutines on the backend in Kotlin,Backend,17,how kotlin handles coroutines the backend useful for writing asynchronous service code that reads like synchronous code
cnt_0776,Adaptive layouts: Supporting tablets and foldables,Mobile,17,practical notes supporting tablets and foldables using adaptive layouts aimed designing that scales across different screen sizes
cnt_0777,Why Fault injection testing Matters in Chaos engineering,DevOps,15,how chaos engineering handles fault injection testing useful for verifying systems recover gracefully from failures
cnt_0778,AWS IAM Roles for EC2,Cloud,12,securing aws architectures attaching iam roles ec2 instances instead hardcoding access keys
cnt_0779,SwiftUI @StateObject and @ObservedObject,Mobile,13,managing observable data flows and state lifecycle ios apps using swiftui property wrappers
cnt_0780,Webhooks Deep Dive: Event-driven integrations,Backend,15,exploring event driven integrations with webhooks way notifying external systems when something happens real time
cnt_0781,A Practical Guide to Backward compatibility,Backend,15,hands look backward compatibility api versioning essential for avoiding breaking changes for existing api consumers
cnt_0782,Django Middleware custom development,Backend,13,how write custom middleware django intercept log modify incoming http requests and responses
cnt_0783,Why Cold vs hot storage tiers Matters in Cloud storage,Cloud,18,hands look cold hot storage tiers cloud storage essential for balancing cost against retrieval speed for stored data
cnt_0784,Native modules: Bridging platform APIs,Mobile,15,exploring bridging platform apis with native modules way exposing camera sensor access cross platform app
cnt_0785,API Rate Limiting with Token Bucket,Backend,10,implementing rate limiting algorithms backend applications prevent denial service attacks
cnt_0786,Cloud Infrastructure Costs Analysis,Cloud,13,using budgets cost tracking tags and cost analysis dashboards optimize monthly cloud bills
cnt_0787,Testing Library: User-centric component tests,Frontend,17,exploring user centric component tests with testing library way testing the way real user would interact with
cnt_0788,Word embeddings Best Practices for Word2Vec and GloVe,Data Science,16,how word embeddings handles word2vec and glove useful for representing words dense vectors that capture meaning
cnt_0789,Laravel: Eloquent ORM relationships,Backend,17,key concepts behind eloquent orm relationships laravel relevant modeling one many and many many associations between tables
cnt_0790,Feature engineering: Encoding categorical variables,Data Science,16,practical notes encoding categorical variables using feature engineering aimed preparing non numeric data for machinelearning models
cnt_0791,A Practical Guide to Decoupling services,Cloud,13,key concepts behind decoupling services cloud queues relevant buffering messages between distributed components
cnt_0792,Database normalization: Reducing redundancy,Databases,11,overview reducing redundancy database normalization focused organizing tables avoid duplicate data
cnt_0793,SVG icons Best Practices for inline vector graphics,Frontend,15,how svg icons handles inline vector graphics useful for keeping icons crisp any screen resolution
cnt_0794,Getting Started with Camera integration,Mobile,16,practical notes capturing and processing photos using camera integration aimed adding photo capture features mobile app
cnt_0795,A Practical Guide to Compiled reactivity,Frontend,15,how svelte handles compiled reactivity useful for updating the dom without virtual dom diffing step
cnt_0796,ETL pipelines Best Practices for extract-transform-load,Data Engineering,16,how etl pipelines handles extract transform load useful for moving raw data into clean queryable format
cnt_0797,A Practical Guide to Stateless authentication,Backend,14,practical notes stateless authentication using jwt aimed issuing signed tokens instead server side sessions
cnt_0798,Ansible Best Practices for idempotent playbooks,DevOps,13,how ansible handles idempotent playbooks useful for applying configuration changes safely multiple times
cnt_0799,Spring Boot Testing with Mockito,Backend,14,writing unit and integration tests for java backend services using junit mockito and mockbean
cnt_0800,Why Core Data Matters in iOS,Mobile,14,key concepts behind core data ios relevant persisting structured app data locally the device
cnt_0801,Cloud load balancers Best Practices for distributing traffic globally,Cloud,16,practical notes distributing traffic globally using cloud load balancers aimed routing users the nearest healthy region
cnt_0802,Understanding Reducing app startup time in Mobile performance,Mobile,17,practical notes reducing app startup time using mobile performance aimed improving the first impression users get app
cnt_0803,Understanding Slow query logs in Database monitoring,Databases,13,exploring slow query logs with database monitoring way identifying queries that need optimization
cnt_0804,Getting Started with Auto-scaling,Cloud,15,practical notes scaling based custom metrics using auto scaling aimed reacting application specific load signals
cnt_0805,Serverless functions Deep Dive: Cold starts,Backend,15,how serverless functions handles cold starts useful for reducing latency for infrequently invoked backend endpoints
cnt_0806,Spark DataFrame optimization,Data Engineering,11,improving pyspark execution times using partition pruning broadcast joins and caching
cnt_0807,A Practical Guide to Reactive forms,Frontend,11,exploring reactive forms with angular way validating complex user input declaratively
cnt_0808,Amazon S3 Best Practices for object storage lifecycle policies,Cloud,14,exploring objectstorage lifecycle policies with amazon way automatically archiving old data cheaper storage tiers
cnt_0809,Flask Best Practices for blueprints,Backend,13,hands look blueprints flask essential for organizing large applications into modular reusable components
cnt_0810,Getting Started with Log aggregation,DevOps,13,exploring structured logging with log aggregation way making logs easier search and correlate
cnt_0811,Delta Lake Deep Dive: ACID transactions on data lakes,Data Engineering,15,practical notes acid transactions datalakes using delta lake aimed adding reliability large scale data storage
cnt_0812,Why Background task scheduling Matters in Battery optimization,Mobile,16,practical notes background task scheduling using battery optimization aimed minimizing power drain from background app activity
cnt_0813,Understanding Round robin vs least connections in Load balancing algorithms,Backend,17,how load balancing algorithms handles round robin least connections useful for distributing traffic evenly across backend replicas
cnt_0814,Why Isolated component development Matters in Storybook,Frontend,15,exploring isolated component development with storybook way building and documenting pieces outside the full app
cnt_0815,Model interpretability Best Practices for SHAP values,Data Science,13,practical notes shap values using model interpretability aimed explaining individual predictions complex model
cnt_0816,Serverless functions: Cold starts,Backend,14,exploring cold starts with serverless functions way reducing latency for infrequently invoked backend endpoints
cnt_0817,Getting Started with Battery optimization,Mobile,16,how battery optimization handles background task scheduling useful for minimizing power drain from background app activity
cnt_0818,iOS: Core Data,Mobile,13,exploring core data with ios way persisting structured app data locally the device
cnt_0819,Cross-platform state management: Provider and Riverpod,Mobile,16,overview provider and riverpod cross platform state management focused sharing app state across flutter widgets cleanly
cnt_0820,Getting Started with OAuth2,Backend,15,exploring authorization flows with oauth2 way delegating access without sharing user passwords with third parties
cnt_0821,AWS Lambda Deep Dive: Serverless functions,Cloud,14,key concepts behind serverless functions aws lambda relevant running code without provisioning managing servers
cnt_0822,Data warehouses Deep Dive: Snowflake architecture,Data Engineering,13,exploring snowflake architecture with datawarehouses way separating storage and compute for analytical workloads
cnt_0823,Tailwind Utility Classes custom setup,Frontend,14,configuring tailwind config js extend themes define custom breakpoints and add custom utility classes
cnt_0824,Why Customizing plots Matters in Matplotlib,Data Science,10,overview customizing plots matplotlib focused communicating insights clearly through visualizations
cnt_0825,Why Serverless functions Matters in AWS Lambda,Cloud,14,key concepts behind serverless functions aws lambda relevant running code without provisioning managing servers
cnt_0826,Getting Started with Flask,Backend,11,overview blueprints flask focused organizing large applications into modular reusable components
cnt_0827,Flutter Best Practices for the widget tree,Mobile,15,exploring the widget tree with flutter way building cross platform uis from single dart codebase
cnt_0828,Understanding Cloud Run in Google Cloud Platform,Cloud,14,hands look cloud run gcp platform essential for deploying containerized apps without managing infrastructure
cnt_0829,Transactions Best Practices for ACID properties,Databases,14,how transactions handles acid properties useful for guaranteeing consistency even when operations fail midway
cnt_0830,Data warehouses Best Practices for Snowflake architecture,Data Engineering,14,how datawarehouses handles snowflake architecture useful for separating storage and compute for analytical workloads
cnt_0831,Why The Activity lifecycle Matters in Android,Mobile,15,key concepts behind the activity lifecycle android relevant managing state correctly screens rotate go background
cnt_0832,Getting Started with PHP,Backend,13,key concepts behind psr standards php relevant keeping backend codebases interoperable across frameworks
cnt_0833,Training Neural Networks with PyTorch,Data Science,12,defining layers loss functions optimizers and running training loops pytorch for deeplearning
cnt_0834,A Practical Guide to VoiceOver and TalkBack,Mobile,16,practical notes voiceover and talkback using mobile accessibility aimed making apps usable for visually impaired users
cnt_0835,Getting Started with Multipart uploads,Backend,14,exploring handling large files with multipart uploads way processing file uploads efficiently the backend
cnt_0836,Unit testing Best Practices for mocking external services,Backend,15,overview mocking external services unit testing focused isolating business logic from network calls during tests
cnt_0837,Understanding Extract-transform-load in ETL pipelines,Data Engineering,15,exploring extract transform load with etl pipelines way moving raw data into clean queryable format
cnt_0838,Why Kafka partitions Matters in Message brokers,Data Engineering,14,hands look kafka partitions message brokers essential for scaling event consumption across multiple consumers
cnt_0839,Rust Best Practices for the Actix Web framework,Backend,19,how rust handles the actix web framework useful for building high throughput http servers with strong memory safety guarantees
cnt_0840,Understanding Reusable workflows in GitHub Actions,DevOps,12,key concepts behind reusable workflows githubactions relevant sharing logic across multiple repositories
cnt_0841,Configuration management: Environment-specific configs,DevOps,14,hands look environment specific configs configuration management essential for avoiding hardcoded values across deployments
cnt_0842,Content delivery networks Best Practices for edge caching,Cloud,16,how content delivery networks handles edge caching useful for serving content from locations closer end users
cnt_0843,Getting Started with Data ingestion,Data Engineering,16,hands look handling schema drift data ingestion essential for adapting pipelines when source data structure changes
cnt_0844,Getting Started with Push notifications,Mobile,16,hands look firebase cloud messaging push notifications essential for engaging users even when the app closed
cnt_0845,Prometheus Alerting Rules,DevOps,11,defining custom system alert thresholds prometheus and routing notifications via alertmanager
cnt_0846,Infrastructure provisioning: Cloud-native automation,Cloud,13,exploring cloud native automation with infrastructure provisioning way spinning environments consistently and quickly
cnt_0847,SQL Window Functions advanced,Databases,15,using row number rank lead and lag window functions over partitions write complex analytical queries
cnt_0848,Schema Evolution in pipelines,Data Engineering,11,how handle database schema changes without breaking active downstream ingestion pipelines
cnt_0849,Natural Language Processing with spaCy,Data Science,13,building advanced nlp pipelines pos tagging named entity recognition ner and dependency parsing
cnt_0850,Getting Started with Kotlin,Backend,16,exploring coroutines the backend with kotlin way writing asynchronous service code that reads like synchronous code
cnt_0851,Animations Best Practices for the Web Animations API,Frontend,15,key concepts behind the web animations api animations relevant creating smooth transitions without heavy libraries
cnt_0852,Getting Started with Bayesian inference,Data Science,16,practical notes prior and posterior distributions using bayesian inference aimed updating beliefs about parameter data arrives
cnt_0853,SQLite on mobile Best Practices for Room persistence library,Mobile,14,exploring room persistence library with sqlite mobile way storing structured data locally android devices
cnt_0854,Why Read replicas Matters in Replication,Databases,15,how replication handles read replicas useful for scaling read heavy workloads across multiple database copies
cnt_0855,Hybrid cloud Deep Dive: Connecting on-premises and cloud,Cloud,16,practical notes connecting premises and cloud using hybrid cloud aimed extending existing infrastructure into the cloud
cnt_0856,Why Debezium Matters in Change data capture,Data Engineering,15,practical notes debezium using change data capture aimed capturing row level changes from source database
cnt_0857,Data quality checks Best Practices for validation rules,Data Engineering,16,practical notes validation rules using data quality checks aimed catching bad data before reaches downstream systems
cnt_0858,Incident response Deep Dive: Runbooks,DevOps,13,key concepts behind runbooks incident response relevant documenting steps resolve common production issues
cnt_0859,A Practical Guide to Unit testing transformations,Data Engineering,17,how data pipeline testing handles unit testing transformations useful for catching bugs before they reach production data
cnt_0860,A Practical Guide to Lightweight state management,Frontend,12,overview lightweight state management zustand focused avoiding boilerplate compared traditional redux stores
cnt_0861,CSS Grid: Two-dimensional layouts,Frontend,13,overview two dimensional layouts css grid focused arranging elements rows and columns declaratively
cnt_0862,Cloud networking Best Practices for virtual private clouds,Cloud,15,hands look virtual private clouds cloud networking essential for isolating cloud resources within private network
cnt_0863,Getting Started with Data lakes,Data Engineering,15,hands look schema read datalakes essential for storing raw data flexibly before deciding its structure
cnt_0864,Local notifications Best Practices for scheduling reminders,Mobile,14,how local notifications handles scheduling reminders useful for triggering alerts without server round trip
cnt_0865,Understanding Reserved instances in Cloud cost optimization,Cloud,16,practical notes reserved instances using cloud cost optimization aimed reducing compute costs with long term commitments
cnt_0866,Getting Started with In-app purchases,Mobile,15,exploring storekit and billing library with app purchases way implementing subscriptions and one time purchases
cnt_0867,SQLite on mobile: Room persistence library,Mobile,14,exploring room persistence library with sqlite mobile way storing structured data locally android devices
cnt_0868,Virtual Cloud Network Routing rules,Cloud,12,configuring vcn route tables send traffic through internet gateways nat gateways oci
cnt_0869,Database Migration Rollback strategies,Databases,13,how write safe and down migration scripts rollback schema updates without data loss
cnt_0870,Why Building neural networks Matters in PyTorch,Data Science,16,how pytorch handles building neural networks useful for defining custom layers and training loops from scratch
cnt_0871,Understanding Partitioning by date in Data partitioning,Data Engineering,14,key concepts behind partitioning date data partitioning relevant improving query performance large datalake tables
cnt_0872,Docker Multi-stage builds python,DevOps,12,shrinking python docker image sizes from gigabytes megabytes using multi stage builds
cnt_0873,Why Tokenization Matters in Natural Language Processing,Data Science,15,hands look tokenization natural language processing essential for splitting text into units model can process
cnt_0874,Getting Started with A/B testing,Data Science,13,how testing handles statistical significance useful for deciding observed difference real due chance
cnt_0875,Jenkins: Declarative pipelines,DevOps,13,practical notes declarative pipelines using jenkins aimed defining build and deploy steps code
cnt_0876,TypeScript Deep Dive: Type narrowing,Frontend,14,key concepts behind type narrowing typescript relevant catching prop and state mismatches before runtime
cnt_0877,PostgreSQL Indexing Types,Databases,15,comparing tree hash gin and gist indexes postgresql when and how apply each index type
cnt_0878,Multipart uploads Best Practices for handling large files,Backend,15,practical notes handling large files using multipart uploads aimed processing file uploads efficiently the backend
cnt_0879,Web Components Deep Dive: The Shadow DOM,Frontend,17,exploring the shadow dom with webcomponents way encapsulating styles they don leak into the rest the page
cnt_0880,Understanding The Actix Web framework in Rust,Backend,19,key concepts behind the actix web framework rust relevant building high throughput http servers with strong memory safety guarantees
cnt_0881,Parallel processing with Multiprocessing,Data Engineering,11,scaling cpu bound data transformation steps python using the multiprocessing module
cnt_0882,Airflow Dynamic DAGs generation,Data Engineering,14,how write python code that generates multiple apache airflow dags dynamically based config files
cnt_0883,Understanding Convolutional neural networks in Computer vision,Data Science,14,practical notes convolutional neural networks using computer vision aimed extracting spatial features from images
cnt_0884,Apache Kafka: Event streaming,Data Engineering,13,exploring event streaming with apache kafka way moving data between systems real time
cnt_0885,Database sharding Deep Dive: Horizontal partitioning,Databases,13,exploring horizontal partitioning with database sharding way splitting large table across multiple servers
cnt_0886,Understanding Service workers in Progressive Web Apps,Frontend,15,overview service workers progressive web apps focused enabling offline access and background sync the browser
cnt_0887,NestJS: Custom decorators,Backend,12,hands look custom decorators nestjs essential for encapsulating repeated request handling logic
cnt_0888,AWS Lambda Edge functions,Cloud,12,running serverless code closer global users cloudfront edge locations for fast routing
cnt_0889,Getting Started with Web Components,Frontend,18,how webcomponents handles the shadow dom useful for encapsulating styles they don leak into the rest the page
cnt_0890,Terraform: State management,DevOps,13,key concepts behind state management terraform relevant tracking infrastructure changes safely across teams
cnt_0891,Why Encoding categorical variables Matters in Feature engineering,Data Science,16,practical notes encoding categorical variables using feature engineering aimed preparing non numeric data for machinelearning models
cnt_0892,Cloud IAM Deep Dive: Least privilege access,Cloud,14,overview least privilege access cloud iam focused granting only the permissions resource actually needs
cnt_0893,A Practical Guide to Multi-stage builds,DevOps,14,exploring multi stage builds with docker way keeping container images small and production ready
cnt_0894,Getting Started with Cloud functions,Cloud,15,key concepts behind event driven triggers cloud functions relevant running code automatically response cloud events
