id,title,category,word_count,content_clean
cnt_1189,Regularization Deep Dive: L1 and L2 penalties,Data Science,13,practical notes and penalties using regularization aimed preventing model from overfitting training data
cnt_1190,API gateways Best Practices for request routing,Backend,12,overview request routing api gateways focused centralizing authentication and throttling for microservices
cnt_1191,NestJS Best Practices for custom decorators,Backend,10,overview custom decorators nestjs focused encapsulating repeated request handling logic
cnt_1192,Cloud IAM: Least privilege access,Cloud,14,overview least privilege access cloud iam focused granting only the permissions resource actually needs
cnt_1193,Auto-scaling groups Deep Dive: Scaling policies,DevOps,14,hands look scaling policies auto scaling groups essential for adding removing instances based demand
cnt_1194,App onboarding Best Practices for first-run experience,Mobile,13,overview first run experience app onboarding focused guiding new users through core features
cnt_1195,A Practical Guide to The event loop,Backend,14,overview the event loop node js focused handling thousands concurrent connections without blocking threads
cnt_1196,Kubernetes Deep Dive: Horizontal pod autoscaling,DevOps,13,hands look horizontal pod autoscaling kubernetes essential for automatically adjusting replicas based load
cnt_1197,Secure Storage in iOS and Android,Mobile,12,storing sensitive user tokens and credentials using keychain ios and encryptedsharedpreferences android
cnt_1198,Understanding Prior and posterior distributions in Bayesian inference,Data Science,16,key concepts behind prior and posterior distributions bayesian inference relevant updating beliefs about parameter data arrives
cnt_1199,Ruby on Rails Deep Dive: Active Record callbacks,Backend,16,key concepts behind active record callbacks ruby rails relevant running custom logic before after saving record
cnt_1200,A Practical Guide to ACID properties,Databases,14,key concepts behind acid properties transactions relevant guaranteeing consistency even when operations fail midway
cnt_1201,Blue-green deployments Deep Dive: Zero downtime releases,DevOps,16,hands look zero downtime releases blue green deployments essential for switching traffic between two identical environments
cnt_1202,Understanding K-means in Clustering,Data Science,11,overview means clustering focused grouping similar data points without labeled examples
cnt_1203,A Practical Guide to Keras high-level API,Data Science,12,exploring keras high level api with tensorflow way prototyping deeplearning models quickly
cnt_1204,Blue-green deployments: Zero downtime releases,DevOps,16,hands look zero downtime releases blue green deployments essential for switching traffic between two identical environments
cnt_1205,CSS-in-JS Deep Dive: Styled-components,Frontend,14,hands look styled components css js essential for scoping styles directly individual react components
cnt_1206,Getting Started with PostgreSQL,Databases,12,practical notes indexing strategies using postgresql aimed speeding query performance large tables
cnt_1207,Understanding Debezium in Change data capture,Data Engineering,15,how change data capture handles debezium useful for capturing row level changes from source database
cnt_1208,Understanding Schema design in MongoDB,Databases,13,key concepts behind schema design mongodb relevant modeling documents for flexible evolving data
cnt_1209,Getting Started with Data warehousing,Databases,14,practical notes star schema design using data warehousing aimed optimizing tables for analytical queries
cnt_1210,Understanding Query optimization in MySQL,Databases,13,how mysql handles query optimization useful for rewriting slow queries using explain plans
cnt_1211,Getting Started with Vue.js,Frontend,14,exploring the composition api with vue js way organizing component logic feature instead option
cnt_1212,A Practical Guide to UI automation frameworks,Mobile,16,hands look automation frameworks mobile testing essential for running end end tests real devices and simulators
cnt_1213,Understanding Middleware chains in Express.js,Backend,15,overview middleware chains express js focused handling authentication logging and error handling single request pipeline
cnt_1214,SASS nesting and variables,Frontend,15,writing modular and clean css with sass preprocessor utilizing nesting variables mixins and inheritance stylesheets
cnt_1215,Getting Started with Spring Boot,Backend,13,exploring dependency injection with springboot way wiring services and repositories automatically through annotations
cnt_1216,Parquet files Best Practices for columnar storage,Data Engineering,13,how parquet files handles columnar storage useful for speeding analytical queries large datasets
cnt_1217,Understanding Distributing traffic globally in Cloud load balancers,Cloud,16,practical notes distributing traffic globally using cloud load balancers aimed routing users the nearest healthy region
cnt_1218,Why Stacking classifiers Matters in Ensemble methods,Data Science,11,overview stacking classifiers ensemble methods focused combining multiple models improve accuracy
cnt_1219,Why Precomputed query results Matters in Materialized views,Databases,13,hands look precomputed query results materialized views essential for speeding expensive aggregate queries
cnt_1220,Text Data Augmentation in NLP,Data Science,13,increasing text training dataset sizes using back translation synonym replacement and random deletion
cnt_1221,Browser rendering Best Practices for the critical rendering path,Frontend,18,key concepts behind the critical rendering path browser rendering relevant understanding how html css and js become pixels
cnt_1222,Recommender systems Deep Dive: Collaborative filtering,Data Science,14,practical notes collaborative filtering using recommender systems aimed suggesting items based similar user behavior
cnt_1223,Wearable apps: WatchOS and Wear OS,Mobile,14,how wearable apps handles watchos and wear useful for extending mobile app experience smartwatches
cnt_1224,Getting Started with WebSockets,Backend,14,key concepts behind real time communication websockets relevant pushing live updates clients without polling
cnt_1225,Understanding Stateless authentication in JWT,Backend,13,exploring stateless authentication with jwt way issuing signed tokens instead server side sessions
cnt_1226,Data governance: Access control policies,Data Engineering,16,how data governance handles access control policies useful for controlling who can view modify sensitive datasets
cnt_1227,Why Row-level security Matters in Database security,Databases,15,how database security handles row level security useful for restricting which rows user can access
cnt_1228,Getting Started with scikit-learn,Data Science,14,key concepts behind cross validation scikit learn relevant getting more reliable estimate model performance
cnt_1229,Cloudflare Workers edge runtime,Cloud,11,building serverless applications directly cdn edge servers with ultra low latency
cnt_1230,ORMs: The N+1 query problem,Databases,16,how orms handles the query problem useful for avoiding excessive database round trips from lazy loading
cnt_1231,Understanding Readiness and liveness probes in Container orchestration,DevOps,16,key concepts behind readiness and liveness probes container orchestration relevant letting kubernetes know when pod healthy
cnt_1232,Why ACID properties Matters in Transactions,Databases,14,practical notes acid properties using transactions aimed guaranteeing consistency even when operations fail midway
cnt_1233,Full-text search Best Practices for PostgreSQL tsvector,Databases,16,hands look postgresql tsvector full text search essential for searching large text fields efficiently inside database
cnt_1234,Why Gradient boosting Matters in XGBoost,Data Science,14,practical notes gradient boosting using xgboost aimed combining weak learners into strong predictive model
cnt_1235,Understanding DAG scheduling in Apache Airflow,Data Engineering,13,practical notes dag scheduling using apache airflow aimed orchestrating dependent data pipeline tasks
cnt_1236,Message brokers: Kafka partitions,Data Engineering,14,key concepts behind kafka partitions message brokers relevant scaling event consumption across multiple consumers
cnt_1237,Understanding Transforming data in the warehouse in ELT pipelines,Data Engineering,15,how elt pipelines handles transforming data the warehouse useful for leveraging warehouse compute for transformations
cnt_1238,Understanding Idempotent tasks in Data pipelines,Data Engineering,14,key concepts behind idempotent tasks data pipelines relevant safely rerunning pipeline without duplicating data
cnt_1239,PL/SQL Triggers creation,Databases,10,writing advanced triggers oracle postgresql automate data validation table mutations
cnt_1240,Getting Started with Object storage,Cloud,14,key concepts behind versioning and immutability objectstorage relevant protecting stored data from accidental deletion
cnt_1241,Understanding Templating Kubernetes manifests in Helm charts,DevOps,12,exploring templating kubernetes manifests with helm charts way reusing configuration across environments
cnt_1242,Serverless architectures: Cold start latency,Cloud,16,practical notes cold start latency using serverless architectures aimed understanding the tradeoffs pay per use compute
cnt_1243,Mobile CI/CD: Fastlane automation,Mobile,14,practical notes fastlane automation using mobile cicd aimed automating builds signing and store submissions
cnt_1244,Web Components: The Shadow DOM,Frontend,18,practical notes the shadow dom using webcomponents aimed encapsulating styles they don leak into the rest the page
cnt_1245,Why SwiftUI declarative views Matters in Swift,Mobile,16,hands look swiftui declarative views swift essential for building ios interfaces with less imperative uikit code
cnt_1246,API versioning Best Practices for backward compatibility,Backend,13,overview backward compatibility api versioning focused avoiding breaking changes for existing api consumers
cnt_1247,Change data capture: Streaming database changes,Databases,15,exploring streaming database changes with change data capture way propagating updates other systems real time
cnt_1248,NumPy Deep Dive: Vectorized operations,Data Science,11,overview vectorized operations numpy focused speeding numerical computations without explicit loops
cnt_1249,MongoDB Aggregation Pipelines,Databases,12,building advanced multi stage aggregation pipelines match group lookup and project stages
cnt_1250,Getting Started with Apache Airflow,Data Engineering,13,key concepts behind dag scheduling apache airflow relevant orchestrating dependent data pipeline tasks
cnt_1251,Understanding Error budgets in SRE practices,DevOps,13,exploring error budgets with sre practices way balancing reliability work against feature velocity
cnt_1252,Design systems Deep Dive: Component libraries,Frontend,15,how design systems handles component libraries useful for keeping visual consistency across large product teams
cnt_1253,Understanding Automated rollback in CI/CD pipelines,DevOps,13,how cicd pipelines handles automated rollback useful for reverting bad deployment automatically failure
cnt_1254,Offline Sync in Mobile apps,Mobile,11,designing synchronization queues upload cached offline database changes once connectivity restored
cnt_1255,Database normalization Best Practices for reducing redundancy,Databases,13,practical notes reducing redundancy using database normalization aimed organizing tables avoid duplicate data
cnt_1256,Form validation Best Practices for schema-based validators,Frontend,15,hands look schema based validators form validation essential for keeping validation rules consistent between fields
cnt_1257,Why Neo4j relationships Matters in Graph databases,Databases,13,overview neo4j relationships graph databases focused modeling highly connected data like social networks
cnt_1258,Why Unit testing transformations Matters in Data pipeline testing,Data Engineering,17,how data pipeline testing handles unit testing transformations useful for catching bugs before they reach production data
cnt_1259,Getting Started with Micro frontends,Frontend,16,exploring module federation with micro frontends way letting independent teams ship parts the same web app
cnt_1260,Object storage: Versioning and immutability,Cloud,14,hands look versioning and immutability objectstorage essential for protecting stored data from accidental deletion
cnt_1261,Redis Deep Dive: Session storage,Backend,13,overview session storage redis focused sharing login state across multiple backend server instances
cnt_1262,Why SHAP values Matters in Model interpretability,Data Science,13,key concepts behind shap values model interpretability relevant explaining individual predictions complex model
cnt_1263,A Practical Guide to L1 and L2 penalties,Data Science,11,overview and penalties regularization focused preventing model from overfitting training data
cnt_1264,A Practical Guide to Versioning and immutability,Cloud,12,overview versioning and immutability objectstorage focused protecting stored data from accidental deletion
cnt_1265,A/B testing Deep Dive: Statistical significance,Data Science,12,exploring statistical significance with testing way deciding observed difference real due chance
cnt_1266,A Practical Guide to First-run experience,Mobile,15,practical notes first run experience using app onboarding aimed guiding new users through core features
cnt_1267,Getting Started with Animations,Frontend,15,hands look the web animations api animations essential for creating smooth transitions without heavy libraries
cnt_1268,Understanding B-tree vs hash indexes in Database indexing,Databases,16,exploring tree hash indexes with database indexing way choosing the right index type for query pattern
cnt_1269,GitOps Best Practices for declarative deployments,DevOps,13,overview declarative deployments gitops focused using git the single source truth for infrastructure
cnt_1270,Mobile offline support Best Practices for local caching strategies,Mobile,17,hands look local caching strategies mobile offline support essential for keeping the app usable without internet connection
cnt_1271,A Practical Guide to Universal links,Mobile,15,key concepts behind universal links deep linking relevant opening specific screen app directly from url
cnt_1272,Why Versioning and immutability Matters in Object storage,Cloud,14,practical notes versioning and immutability using objectstorage aimed protecting stored data from accidental deletion
cnt_1273,Browser rendering Deep Dive: The critical rendering path,Frontend,17,exploring the critical rendering path with browser rendering way understanding how html css and js become pixels
cnt_1274,Android Best Practices for the Activity lifecycle,Mobile,15,how android handles the activity lifecycle useful for managing state correctly screens rotate go background
cnt_1275,Getting Started with SRE practices,DevOps,14,hands look error budgets sre practices essential for balancing reliability work against feature velocity
cnt_1276,Understanding The Shadow DOM in Web Components,Frontend,16,overview the shadow dom webcomponents focused encapsulating styles they don leak into the rest the page
cnt_1277,Getting Started with Apache Spark,Data Engineering,14,hands look distributed data processing apache spark essential for transforming large datasets across cluster
cnt_1278,Getting Started with App onboarding,Mobile,15,key concepts behind first run experience app onboarding relevant guiding new users through core features
cnt_1279,Understanding Bridging platform APIs in Native modules,Mobile,16,hands look bridging platform apis native modules essential for exposing camera sensor access cross platform app
cnt_1280,API versioning Deep Dive: Backward compatibility,Backend,14,exploring backward compatibility with api versioning way avoiding breaking changes for existing api consumers
cnt_1281,Getting Started with Data orchestration,Data Engineering,15,how data orchestration handles task retries and backoff useful for handling transient failures scheduled pipelines
cnt_1282,Amazon S3 Deep Dive: Object storage lifecycle policies,Cloud,15,key concepts behind objectstorage lifecycle policies amazon relevant automatically archiving old data cheaper storage tiers
cnt_1283,Why Statistical significance Matters in A/B testing,Data Science,13,how testing handles statistical significance useful for deciding observed difference real due chance
cnt_1284,Canary releases Best Practices for gradual rollout,DevOps,13,overview gradual rollout canary releases focused exposing new version small subset users first
cnt_1285,Why Word2Vec and GloVe Matters in Word embeddings,Data Science,14,overview word2vec and glove word embeddings focused representing words dense vectors that capture meaning
cnt_1286,Understanding Multi-region failover in Cloud disaster recovery,Cloud,16,practical notes multi region failover using cloud disaster recovery aimed keeping systems available during regional outage
cnt_1287,Data quality checks: Validation rules,Data Engineering,16,how data quality checks handles validation rules useful for catching bad data before reaches downstream systems
cnt_1288,Clustering Best Practices for k-means,Data Science,13,key concepts behind means clustering relevant grouping similar data points without labeled examples
cnt_1289,Clustering: K-means,Data Science,13,how clustering handles means useful for grouping similar data points without labeled examples
cnt_1290,Cloud databases Best Practices for managed database services,Cloud,16,hands look managed database services cloud databases essential for offloading backups and patching the cloud provider
cnt_1291,Understanding Supporting tablets and foldables in Adaptive layouts,Mobile,17,practical notes supporting tablets and foldables using adaptive layouts aimed designing that scales across different screen sizes
cnt_1292,Ruby on Rails Best Practices for Active Record callbacks,Backend,16,practical notes active record callbacks using ruby rails aimed running custom logic before after saving record
cnt_1293,A Practical Guide to Avoiding vendor lock-in,Cloud,16,hands look avoiding vendor lock multi cloud strategy essential for designing systems portable across cloud providers
cnt_1294,Container registries Deep Dive: Image scanning,DevOps,11,overview image scanning container registries focused detecting vulnerabilities before deploying container
cnt_1295,Form handling Best Practices for controlled vs uncontrolled inputs,Frontend,16,practical notes controlled uncontrolled inputs using form handling aimed deciding how form state should managed react
cnt_1296,Auto-scaling: Scaling based on custom metrics,Cloud,15,key concepts behind scaling based custom metrics auto scaling relevant reacting application specific load signals
cnt_1297,Apache Flink Best Practices for stateful stream processing,Data Engineering,15,practical notes stateful stream processing using apache flink aimed maintaining state across events real time
cnt_1298,Why Horizontal partitioning Matters in Database sharding,Databases,14,practical notes horizontal partitioning using database sharding aimed splitting large table across multiple servers
cnt_1299,Parquet files Deep Dive: Columnar storage,Data Engineering,11,overview columnar storage parquet files focused speeding analytical queries large datasets
cnt_1300,Why UI automation frameworks Matters in Mobile testing,Mobile,16,key concepts behind automation frameworks mobile testing relevant running end end tests real devices and simulators
cnt_1301,Getting Started with Wearable apps,Mobile,14,practical notes watchos and wear using wearable apps aimed extending mobile app experience smartwatches
cnt_1302,Dimensionality reduction Best Practices for PCA,Data Science,16,practical notes pca using dimensionality reduction aimed compressing many features into fewer components with minimal loss
cnt_1303,Why Distributing traffic globally Matters in Cloud load balancers,Cloud,16,how cloud load balancers handles distributing traffic globally useful for routing users the nearest healthy region
cnt_1304,A Practical Guide to Pipeline caching,DevOps,13,hands look pipeline caching gitlab essential for speeding builds reusing dependencies between runs
cnt_1305,Adaptive layouts Deep Dive: Supporting tablets and foldables,Mobile,17,how adaptive layouts handles supporting tablets and foldables useful for designing that scales across different screen sizes
cnt_1306,Chaos engineering Best Practices for fault injection testing,DevOps,15,how chaos engineering handles fault injection testing useful for verifying systems recover gracefully from failures
cnt_1307,Getting Started with Deep linking,Mobile,15,how deep linking handles universal links useful for opening specific screen app directly from url
cnt_1308,Understanding Istio traffic management in Service mesh,DevOps,13,key concepts behind istio traffic management service mesh relevant controlling communication between microservices
cnt_1309,Understanding ARIA attributes in Accessibility (a11y),Frontend,13,overview aria attributes accessibility a11y focused making interactive widgets usable with screen readers
cnt_1310,Automating Semantic Versioning,DevOps,12,using semantic release and conventional commits automate version bumps and changelog generation
cnt_1311,Spring Boot Best Practices for dependency injection,Backend,12,overview dependency injection springboot focused wiring services and repositories automatically through annotations
cnt_1312,Auto-scaling groups: Scaling policies,DevOps,14,hands look scaling policies auto scaling groups essential for adding removing instances based demand
cnt_1313,Understanding Local caching strategies in Mobile offline support,Mobile,16,exploring local caching strategies with mobile offline support way keeping the app usable without internet connection
cnt_1314,Why Universal links Matters in Deep linking,Mobile,14,exploring universal links with deep linking way opening specific screen app directly from url
cnt_1315,Battery optimization: Background task scheduling,Mobile,16,key concepts behind background task scheduling battery optimization relevant minimizing power drain from background app activity
cnt_1316,Idempotency keys Best Practices for safe retries,Backend,16,practical notes safe retries using idempotency keys aimed avoiding duplicate side effects when clients resend requests
cnt_1317,Data pipelines Deep Dive: Idempotent tasks,Data Engineering,13,exploring idempotent tasks with data pipelines way safely rerunning pipeline without duplicating data
cnt_1318,Getting Started with Time series forecasting,Data Science,15,hands look arima models time series forecasting essential for predicting future values based historical patterns
cnt_1319,A Practical Guide to Media queries,Frontend,15,exploring media queries with responsive design way adapting layouts across mobile tablet and desktop breakpoints
cnt_1320,Database partitioning Best Practices for range partitioning,Databases,14,key concepts behind range partitioning database partitioning relevant splitting large tables date another key
cnt_1321,Getting Started with Database indexing,Databases,17,practical notes tree hash indexes using database indexing aimed choosing the right index type for query pattern
cnt_1322,Drag and drop: The HTML5 Drag and Drop API,Frontend,21,hands look the html5 drag and drop api drag and drop essential for building sortable lists and kanban boards the browser
cnt_1323,Why Reducing redundancy Matters in Database normalization,Databases,13,hands look reducing redundancy database normalization essential for organizing tables avoid duplicate data
cnt_1324,Getting Started with NestJS,Backend,11,exploring custom decorators with nestjs way encapsulating repeated request handling logic
cnt_1325,Imbalanced datasets Deep Dive: SMOTE oversampling,Data Science,14,practical notes smote oversampling using imbalanced datasets aimed handling classes with very few examples
cnt_1326,A Practical Guide to Declarative deployments,DevOps,13,overview declarative deployments gitops focused using git the single source truth for infrastructure
cnt_1327,Getting Started with Kotlin,Mobile,14,key concepts behind jetpack compose kotlin relevant writing android uis declaratively without xml layouts
cnt_1328,React Server Actions,Frontend,16,how execute database queries and mutate data directly inside react servercomponents using server actions next js
cnt_1329,Imbalanced datasets Best Practices for SMOTE oversampling,Data Science,13,exploring smote oversampling with imbalanced datasets way handling classes with very few examples
cnt_1330,React Native Best Practices for the bridge architecture,Mobile,16,exploring the bridge architecture with reactnative way letting javascript communicate with native ios and android modules
cnt_1331,Batch processing: Scheduled data jobs,Data Engineering,13,exploring scheduled data jobs with batch processing way running large transformations fixed schedule
cnt_1332,ELT pipelines Deep Dive: Transforming data in the warehouse,Data Engineering,15,key concepts behind transforming data the warehouse elt pipelines relevant leveraging warehouse compute for transformations
cnt_1333,Understanding Session storage in Redis,Backend,15,hands look session storage redis essential for sharing login state across multiple backend server instances
cnt_1334,Change data capture Deep Dive: Streaming database changes,Databases,16,how change data capture handles streaming database changes useful for propagating updates other systems real time
cnt_1335,Understanding Collaborative filtering in Recommender systems,Data Science,12,overview collaborative filtering recommender systems focused suggesting items based similar user behavior
