id,title,category,word_count,content_clean
cnt_0298,A Practical Guide to Embedded databases,Databases,14,key concepts behind embedded databases sqlite relevant storing data locally without separate database server
cnt_0299,Kubernetes: Horizontal pod autoscaling,DevOps,13,how kubernetes handles horizontal pod autoscaling useful for automatically adjusting replicas based load
cnt_0300,Understanding Immutable infrastructure in Infrastructure as Code,DevOps,14,practical notes immutable infrastructure using infrastructure code aimed replacing servers instead patching them place
cnt_0301,A Practical Guide to Certificate pinning,Mobile,14,exploring certificate pinning with mobile security way preventing man the middle attacks api calls
cnt_0302,Cloud functions: Event-driven triggers,Cloud,15,hands look event driven triggers cloud functions essential for running code automatically response cloud events
cnt_0303,GitOps: Declarative deployments,DevOps,15,practical notes declarative deployments using gitops aimed using git the single source truth for infrastructure
cnt_0304,Understanding Perceived performance in Skeleton screens,Frontend,14,exploring perceived performance with skeleton screens way showing placeholder content while data still loading
cnt_0305,Django REST Framework Best Practices for building serializers,Backend,17,key concepts behind building serializers django rest framework relevant converting complex querysets into json for api responses
cnt_0306,Cloud load balancers Deep Dive: Distributing traffic globally,Cloud,14,overview distributing traffic globally cloud load balancers focused routing users the nearest healthy region
cnt_0307,Getting Started with Mobile CI/CD,Mobile,13,exploring fastlane automation with mobile cicd way automating builds signing and store submissions
cnt_0308,A Practical Guide to Perceived performance,Frontend,14,exploring perceived performance with skeleton screens way showing placeholder content while data still loading
cnt_0309,Getting Started with Feature engineering,Data Science,16,hands look encoding categorical variables feature engineering essential for preparing non numeric data for machinelearning models
cnt_0310,Getting Started with Seaborn,Data Science,13,key concepts behind statistical plots seaborn relevant visualizing distributions and relationships between variables
cnt_0311,Container orchestration Deep Dive: Readiness and liveness probes,DevOps,15,exploring readiness and liveness probes with container orchestration way letting kubernetes know when pod healthy
cnt_0312,Serverless architectures Deep Dive: Cold start latency,Cloud,16,how serverless architectures handles cold start latency useful for understanding the tradeoffs pay per use compute
cnt_0313,Data pipeline testing Deep Dive: Unit testing transformations,Data Engineering,17,key concepts behind unit testing transformations data pipeline testing relevant catching bugs before they reach production data
cnt_0314,Data SLAs monitoring,Data Engineering,12,setting alerts and tracking systems ensure pipelines complete and datasets refresh schedule
cnt_0315,PostgreSQL: Indexing strategies,Databases,12,hands look indexing strategies postgresql essential for speeding query performance large tables
cnt_0316,Asyncio in Python,Backend,15,understanding event loops coroutines async and await keywords python backend services for high concurrency tasks
cnt_0317,Battery optimization Best Practices for background task scheduling,Mobile,14,overview background task scheduling battery optimization focused minimizing power drain from background app activity
cnt_0318,WebSockets: Real-time communication,Backend,13,exploring real time communication with websockets way pushing live updates clients without polling
cnt_0319,Why Collaborative filtering Matters in Recommender systems,Data Science,14,practical notes collaborative filtering using recommender systems aimed suggesting items based similar user behavior
cnt_0320,XGBoost Deep Dive: Gradient boosting,Data Science,14,hands look gradient boosting xgboost essential for combining weak learners into strong predictive model
cnt_0321,Understanding Data structures in Redis,Databases,17,how redis handles data structures useful for using sorted sets and hashes beyond simple key value caching
cnt_0322,A Practical Guide to Authorization flows,Backend,14,overview authorization flows oauth2 focused delegating access without sharing user passwords with third parties
cnt_0323,App Store review Best Practices for guidelines compliance,Mobile,15,how app store review handles guidelines compliance useful for avoiding common rejection reasons before submission
cnt_0324,ES6 Modules on the Web,Frontend,11,importing and exporting javascript modules natively modern browsers without needing bundler
cnt_0325,A Practical Guide to Custom hooks,Frontend,11,overview custom hooks react focused extracting reusable stateful logic between components
cnt_0326,Understanding Alerting rules in Grafana,DevOps,12,overview alerting rules grafana focused notifying teams automatically when metrics cross thresholds
cnt_0327,Why Point-in-time recovery Matters in Database backups,Databases,15,exploring point time recovery with database backups way restoring data specific moment after data loss
cnt_0328,Why Plotly Dash Matters in Data visualization dashboards,Data Science,15,key concepts behind plotly dash data visualization dashboards relevant building interactive exploratory tools for stakeholders
cnt_0329,Materialized views: Precomputed query results,Databases,13,hands look precomputed query results materialized views essential for speeding expensive aggregate queries
cnt_0330,Understanding Room persistence library in SQLite on mobile,Mobile,15,practical notes room persistence library using sqlite mobile aimed storing structured data locally android devices
cnt_0331,Data Observability metrics,Data Engineering,13,monitoring pipeline volume metrics run durations and row counts detect silent ingestion failures
cnt_0332,Understanding Safe retries in Idempotency keys,Backend,16,practical notes safe retries using idempotency keys aimed avoiding duplicate side effects when clients resend requests
cnt_0333,Understanding Neo4j relationships in Graph databases,Databases,15,hands look neo4j relationships graph databases essential for modeling highly connected data like social networks
cnt_0334,Database partitioning: Range partitioning,Databases,13,exploring range partitioning with database partitioning way splitting large tables date another key
cnt_0335,Getting Started with AWS Lambda,Cloud,14,hands look serverless functions aws lambda essential for running code without provisioning managing servers
cnt_0336,Terraform Deep Dive: State management,DevOps,13,key concepts behind state management terraform relevant tracking infrastructure changes safely across teams
cnt_0337,Word embeddings: Word2Vec and GloVe,Data Science,16,key concepts behind word2vec and glove word embeddings relevant representing words dense vectors that capture meaning
cnt_0338,Why StoreKit and Billing Library Matters in In-app purchases,Mobile,15,exploring storekit and billing library with app purchases way implementing subscriptions and one time purchases
cnt_0339,A Practical Guide to Plotly Dash,Data Science,15,key concepts behind plotly dash data visualization dashboards relevant building interactive exploratory tools for stakeholders
cnt_0340,Understanding User-centric component tests in Testing Library,Frontend,17,exploring user centric component tests with testing library way testing the way real user would interact with
cnt_0341,Getting Started with Container orchestration,DevOps,16,practical notes readiness and liveness probes using container orchestration aimed letting kubernetes know when pod healthy
cnt_0342,Understanding Windowed aggregations in Stream processing,Data Engineering,14,how stream processing handles windowed aggregations useful for computing metrics over continuously arriving data
cnt_0343,Google Cloud Platform Best Practices for Cloud Run,Cloud,14,practical notes cloud run using gcp platform aimed deploying containerized apps without managing infrastructure
cnt_0344,ELT pipelines Best Practices for transforming data in the warehouse,Data Engineering,14,exploring transforming data the warehouse with elt pipelines way leveraging warehouse compute for transformations
cnt_0345,Ensemble methods Best Practices for stacking classifiers,Data Science,13,practical notes stacking classifiers using ensemble methods aimed combining multiple models improve accuracy
cnt_0346,Cassandra Best Practices for wide-column storage,Databases,15,how cassandra handles wide column storage useful for handling massive write throughput across distributed nodes
cnt_0347,Understanding Custom decorators in NestJS,Backend,12,practical notes custom decorators using nestjs aimed encapsulating repeated request handling logic
cnt_0348,A Practical Guide to Access control policies,Data Engineering,16,how data governance handles access control policies useful for controlling who can view modify sensitive datasets
cnt_0349,Getting Started with Cloud monitoring,Cloud,15,key concepts behind centralized observability cloud monitoring relevant tracking metrics and logs across cloud resources
cnt_0350,Understanding Active Record callbacks in Ruby on Rails,Backend,14,overview active record callbacks ruby rails focused running custom logic before after saving record
cnt_0351,Getting Started with Form handling,Frontend,16,hands look controlled uncontrolled inputs form handling essential for deciding how form state should managed react
cnt_0352,Database security Deep Dive: Row-level security,Databases,15,key concepts behind row level security database security relevant restricting which rows user can access
cnt_0353,A Practical Guide to Inverted indexes,Databases,15,key concepts behind inverted indexes elasticsearch relevant enabling fast full text search across large datasets
cnt_0354,Web Vitals Best Practices for Largest Contentful Paint,Frontend,14,exploring largest contentful paint with web vitals way measuring real user perceived loading performance
cnt_0355,A Practical Guide to Distributing traffic globally,Cloud,16,how cloud load balancers handles distributing traffic globally useful for routing users the nearest healthy region
cnt_0356,FastAPI Deep Dive: Pydantic validation,Backend,12,overview pydantic validation fastapi focused enforcing request schemas automatically with type hints
cnt_0357,Why Indexing strategies Matters in PostgreSQL,Databases,12,hands look indexing strategies postgresql essential for speeding query performance large tables
cnt_0358,Why Automated rollback Matters in CI/CD pipelines,DevOps,12,exploring automated rollback with cicd pipelines way reverting bad deployment automatically failure
cnt_0359,Getting Started with Matplotlib,Data Science,12,how matplotlib handles customizing plots useful for communicating insights clearly through visualizations
cnt_0360,Natural Language Processing Best Practices for tokenization,Data Science,14,exploring tokenization with natural language processing way splitting text into units model can process
cnt_0361,Why Convolutional neural networks Matters in Computer vision,Data Science,13,exploring convolutional neural networks with computer vision way extracting spatial features from images
cnt_0362,Why Data residency requirements Matters in Cloud compliance,Cloud,15,how cloud compliance handles data residency requirements useful for keeping data within required geographic boundaries
cnt_0363,Cloud disaster recovery Deep Dive: Multi-region failover,Cloud,16,key concepts behind multi region failover cloud disaster recovery relevant keeping systems available during regional outage
cnt_0364,Understanding Isolated component development in Storybook,Frontend,16,key concepts behind isolated component development storybook relevant building and documenting pieces outside the full app
cnt_0365,SRE practices: Error budgets,DevOps,14,practical notes error budgets using sre practices aimed balancing reliability work against feature velocity
cnt_0366,Understanding StoreKit and Billing Library in In-app purchases,Mobile,15,exploring storekit and billing library with app purchases way implementing subscriptions and one time purchases
cnt_0367,Model interpretability: SHAP values,Data Science,13,how model interpretability handles shap values useful for explaining individual predictions complex model
cnt_0368,A Practical Guide to Inline vector graphics,Frontend,13,overview inline vector graphics svg icons focused keeping icons crisp any screen resolution
cnt_0369,A Practical Guide to Serverless functions,Cloud,14,how aws lambda handles serverless functions useful for running code without provisioning managing servers
cnt_0370,Cypress Component Testing,Frontend,14,writing fast and reliable component tests isolation with cypress instead full end end flows
cnt_0371,Go: Goroutines,Backend,12,overview goroutines go focused running lightweight concurrent tasks with channels for synchronization
cnt_0372,Why Media queries Matters in Responsive design,Frontend,16,hands look media queries responsive design essential for adapting layouts across mobile tablet and desktop breakpoints
cnt_0373,Cloud IAM Best Practices for least privilege access,Cloud,16,key concepts behind least privilege access cloud iam relevant granting only the permissions resource actually needs
cnt_0374,A Practical Guide to Prior and posterior distributions,Data Science,15,exploring prior and posterior distributions with bayesian inference way updating beliefs about parameter data arrives
cnt_0375,Why VoiceOver and TalkBack Matters in Mobile accessibility,Mobile,16,hands look voiceover and talkback mobile accessibility essential for making apps usable for visually impaired users
cnt_0376,A Practical Guide to Coroutines on the backend,Backend,17,practical notes coroutines the backend using kotlin aimed writing asynchronous service code that reads like synchronous code
cnt_0377,A Practical Guide to Snowflake architecture,Data Engineering,14,key concepts behind snowflake architecture datawarehouses relevant separating storage and compute for analytical workloads
cnt_0378,Model interpretability Deep Dive: SHAP values,Data Science,13,key concepts behind shap values model interpretability relevant explaining individual predictions complex model
cnt_0379,Understanding The bridge architecture in React Native,Mobile,16,exploring the bridge architecture with reactnative way letting javascript communicate with native ios and android modules
cnt_0380,Why Resource groups Matters in Azure,Cloud,14,practical notes resource groups using azure aimed organizing related cloud resources for easier management
cnt_0381,Design systems Best Practices for component libraries,Frontend,13,overview component libraries design systems focused keeping visual consistency across large product teams
cnt_0382,Understanding Object storage lifecycle policies in Amazon S3,Cloud,15,practical notes objectstorage lifecycle policies using amazon aimed automatically archiving old data cheaper storage tiers
cnt_0383,ETL pipelines: Extract-transform-load,Data Engineering,16,practical notes extract transform load using etl pipelines aimed moving raw data into clean queryable format
cnt_0384,Understanding Scheduling reminders in Local notifications,Mobile,14,practical notes scheduling reminders using local notifications aimed triggering alerts without server round trip
cnt_0385,Data Quality Frameworks,Data Engineering,11,validating data schemas null constraints and value distributions using great expectations
cnt_0386,Change data capture Best Practices for Debezium,Data Engineering,15,hands look debezium change data capture essential for capturing row level changes from source database
cnt_0387,A Practical Guide to Network access rules,Cloud,16,hands look network access rules cloud security groups essential for controlling inbound and outbound traffic resources
cnt_0388,Getting Started with Blue-green deployments,DevOps,16,how blue green deployments handles zero downtime releases useful for switching traffic between two identical environments
cnt_0389,Data visualization dashboards Best Practices for Plotly Dash,Data Science,13,overview plotly dash data visualization dashboards focused building interactive exploratory tools for stakeholders
cnt_0390,Connection pooling: Reusing database connections,Databases,15,hands look reusing database connections connection pooling essential for reducing overhead for high traffic applications
cnt_0391,Getting Started with Cloud queues,Cloud,13,hands look decoupling services cloud queues essential for buffering messages between distributed components
cnt_0392,Why Reserved instances Matters in Cloud cost optimization,Cloud,16,hands look reserved instances cloud cost optimization essential for reducing compute costs with long term commitments
cnt_0393,Jupyter notebooks Deep Dive: Reproducible analysis,Data Science,14,key concepts behind reproducible analysis jupyter notebooks relevant documenting the full data exploration workflow
cnt_0394,Getting Started with Imbalanced datasets,Data Science,12,overview smote oversampling imbalanced datasets focused handling classes with very few examples
cnt_0395,Webpack Best Practices for code splitting,Frontend,14,how webpack handles code splitting useful for loading only the javascript page actually needs
cnt_0396,Database security: Row-level security,Databases,15,key concepts behind row level security database security relevant restricting which rows user can access
cnt_0397,A Practical Guide to Data transformation as code,Data Engineering,14,hands look data transformation code dbt essential for applying software engineering practices sql models
cnt_0398,A Practical Guide to The bridge architecture,Mobile,17,practical notes the bridge architecture using reactnative aimed letting javascript communicate with native ios and android modules
cnt_0399,Tokenization techniques in NLP,Data Science,12,how modern tokenizers split text into subwords words characters for transformer models
cnt_0400,Optimizing SQL Join performance,Databases,15,how hash joins nested loop joins and merge joins work under the hood sql engines
cnt_0401,Cross-platform state management Best Practices for Provider and Riverpod,Mobile,16,overview provider and riverpod cross platform state management focused sharing app state across flutter widgets cleanly
cnt_0402,PHP Deep Dive: PSR standards,Backend,13,hands look psr standards php essential for keeping backend codebases interoperable across frameworks
cnt_0403,iOS Best Practices for Core Data,Mobile,14,practical notes core data using ios aimed persisting structured app data locally the device
cnt_0404,Storybook Deep Dive: Isolated component development,Frontend,16,practical notes isolated component development using storybook aimed building and documenting pieces outside the full app
cnt_0405,Google Cloud Platform: Cloud Run,Cloud,14,practical notes cloud run using gcp platform aimed deploying containerized apps without managing infrastructure
cnt_0406,Ruby on Rails: Active Record callbacks,Backend,16,hands look active record callbacks ruby rails essential for running custom logic before after saving record
cnt_0407,Prometheus: Custom metrics,DevOps,12,key concepts behind custom metrics prometheus relevant monitoring application specific health indicators
cnt_0408,Celery Best Practices for background task scheduling,Backend,16,key concepts behind background task scheduling celery relevant running periodic jobs outside the main web process
cnt_0409,Why The reducer pattern Matters in Redux,Frontend,14,exploring the reducer pattern with redux way managing predictable global state across large applications
cnt_0410,Why Two-dimensional layouts Matters in CSS Grid,Frontend,15,practical notes two dimensional layouts using css grid aimed arranging elements rows and columns declaratively
cnt_0411,A Practical Guide to Statistical plots,Data Science,12,exploring statistical plots with seaborn way visualizing distributions and relationships between variables
cnt_0412,Getting Started with Database migrations,Databases,15,key concepts behind versioned schema changes database migrations relevant evolving database schema safely over time
cnt_0413,CSS-in-JS: Styled-components,Frontend,14,hands look styled components css js essential for scoping styles directly individual react components
cnt_0414,Why Slow query logs Matters in Database monitoring,Databases,14,key concepts behind slow query logs database monitoring relevant identifying queries that need optimization
cnt_0415,Multi-cloud strategy Best Practices for avoiding vendor lock-in,Cloud,16,key concepts behind avoiding vendor lock multi cloud strategy relevant designing systems portable across cloud providers
cnt_0416,Getting Started with Configuration management,DevOps,13,exploring environment specific configs with configuration management way avoiding hardcoded values across deployments
cnt_0417,Prometheus Best Practices for custom metrics,DevOps,12,key concepts behind custom metrics prometheus relevant monitoring application specific health indicators
cnt_0418,Understanding Backward compatibility in API versioning,Backend,14,exploring backward compatibility with api versioning way avoiding breaking changes for existing api consumers
cnt_0419,Why Choosing the right data model Matters in NoSQL vs SQL,Databases,17,hands look choosing the right data model nosql sql essential for deciding between relational and document databases
cnt_0420,Why Tracking data provenance Matters in Data lineage,Data Engineering,14,key concepts behind tracking data provenance data lineage relevant understanding where dataset values originated
cnt_0421,Why Partitioning by date Matters in Data partitioning,Data Engineering,14,practical notes partitioning date using data partitioning aimed improving query performance large datalake tables
cnt_0422,A Practical Guide to Fastlane automation,Mobile,14,practical notes fastlane automation using mobile cicd aimed automating builds signing and store submissions
cnt_0423,Getting Started with Flexbox,Frontend,15,how flexbox handles alignment and distribution useful for building responsive navigation bars and card layouts
cnt_0424,Data lineage Deep Dive: Tracking data provenance,Data Engineering,14,how data lineage handles tracking data provenance useful for understanding where dataset values originated
cnt_0425,Getting Started with Rate limiting,Backend,17,hands look the token bucket algorithm rate limiting essential for protecting api from abuse and traffic spikes
cnt_0426,Why Error budgets Matters in SRE practices,DevOps,12,overview error budgets sre practices focused balancing reliability work against feature velocity
cnt_0427,Getting Started with Cassandra,Databases,15,how cassandra handles wide column storage useful for handling massive write throughput across distributed nodes
cnt_0428,Shadow DOM in Web Components,Frontend,13,encapsulating styles and html structures inside custom elements using browser native shadow dom
cnt_0429,A Practical Guide to Versioned schema changes,Databases,15,hands look versioned schema changes database migrations essential for evolving database schema safely over time
cnt_0430,A Practical Guide to Metadata management,Data Engineering,12,exploring metadata management with data cataloging way making datasets discoverable across organization
cnt_0431,Why Single-page application navigation Matters in Client-side routing,Frontend,17,practical notes single page application navigation using client side routing aimed changing views without full page reload
cnt_0432,Understanding Inversion of control in Dependency injection containers,Backend,15,key concepts behind inversion control dependency injection containers relevant swapping implementations without changing calling code
cnt_0433,A Practical Guide to Horizontal partitioning,Databases,14,key concepts behind horizontal partitioning database sharding relevant splitting large table across multiple servers
cnt_0434,A Practical Guide to Core Data,Mobile,14,hands look core data ios essential for persisting structured app data locally the device
cnt_0435,Understanding Point-in-time recovery in Database backups,Databases,16,key concepts behind point time recovery database backups relevant restoring data specific moment after data loss
cnt_0436,Understanding Progressive delivery in Feature flags,DevOps,13,overview progressive delivery feature flags focused turning features and off without redeploying code
cnt_0437,Understanding ACID properties in Transactions,Databases,14,key concepts behind acid properties transactions relevant guaranteeing consistency even when operations fail midway
cnt_0438,Feature Scaling with StandardScaler,Data Science,12,why and how apply normalization and standardization numerical features before training models
cnt_0439,dbt Semantic Layer integration,Data Engineering,11,defining consistent business metrics once dbt and exposing them multiple tools
cnt_0440,Materialized views Best Practices for precomputed query results,Databases,11,overview precomputed query results materialized views focused speeding expensive aggregate queries
cnt_0441,Cloud queues: Decoupling services,Cloud,12,exploring decoupling services with cloud queues way buffering messages between distributed components
cnt_0442,Understanding Cross-validation in scikit-learn,Data Science,14,how scikit learn handles cross validation useful for getting more reliable estimate model performance
cnt_0443,Flutter Deep Dive: The widget tree,Mobile,16,hands look the widget tree flutter essential for building cross platform uis from single dart codebase
cnt_0444,A Practical Guide to Slow query logs,Databases,14,practical notes slow query logs using database monitoring aimed identifying queries that need optimization
